{
 "pr": 32278,
 "summary": "The PR adds four CAM preferences for the ToolBit shape drawing, makes the Chamfer `Diameter` a derived read-only parameter, and makes the shape drawing theme-aware with a highlight link between each dimension and its property field.",
 "intent": "A reader can find the new \"Tool Bit Shape Drawing\" group in the CAM preferences and can set the dimension color for a light theme, the dimension color for a dark theme, the highlight color, and the artwork brightness. `reference/preferences.adoc` tells this, with the defaults and the 10 % to 100 % range of the brightness. A reader also learns that the Chamfer `Diameter` is not an input: FreeCAD calculates it from `TipDiameter`, `CuttingEdgeHeight` and `CuttingEdgeAngle`, the ToolBit editor does not show it, and the property view shows it as read-only. `tools/tool-shape.adoc` tells this. The theme colors and the highlight between a dimension and its field are appearance only, thus `tools/toolbit.adoc` needs only new figures of the ToolBit editor.",
 "pages": [
  {
   "page": "reference/preferences.adoc",
   "verdict": "revise",
   "role": "primary",
   "needs_gui": true,
   "reason": "Gui/DlgSettingsPathColor.ui: new group box 'Tool Bit Shape Drawing' with ToolBitDimensionColorLight (#111111), ToolBitDimensionColorDark (#23818d), ToolBitDimensionHighlightColor (#ff8c00) and ToolBitArtworkBrightness (85 %, range 10 to 100); Path/Preferences.py adds the four parameter names",
   "sections": [
    "GUI"
   ]
  },
  {
   "page": "tools/tool-shape.adoc",
   "verdict": "revise",
   "role": "primary",
   "needs_gui": true,
   "reason": "Path/Tool/shape/models/chamfer.py: derived_parameters() calculates Diameter = TipDiameter + 2 * CuttingEdgeHeight * tan(CuttingEdgeAngle / 2); toolbit/models/base.py sets editor mode read-only and toolbit/ui/editor.py removes derived parameters from the editor form. This is the part a reader acts on; the theme colors of the drawings are appearance only",
   "sections": [
    "Parameters",
    "Tool Thumbnail Images"
   ]
  },
  {
   "page": "tools/toolbit.adoc",
   "verdict": "capture only",
   "role": "capture",
   "needs_gui": true,
   "reason": "Path/Tool/toolbit/ui/editor.py and shape/models/icon.py: the shape drawing in the ToolBit editor has theme colors and a dimension highlight, and the Chamfer editor form does not show Diameter; figures of the editor are now wrong, the text stays correct",
   "sections": [
    "Toolbit Parameter Editor"
   ]
  },
  {
   "page": "tools/add-toolbit.adoc",
   "verdict": "no change",
   "role": "none",
   "needs_gui": false,
   "reason": "Path/Tool/toolbit/ui/tablecell.py: the list icon drops the dimensions (dimensions=False); appearance only and the page does not describe it",
   "sections": []
  },
  {
   "page": "job/job.adoc",
   "verdict": "no change",
   "role": "none",
   "needs_gui": false,
   "reason": "Path/Main/Gui/Job.py: theme detection moves to Path/Base/Gui/Theme.py; refactor with no change of behaviour",
   "sections": []
  },
  {
   "page": "reference/experimental.adoc",
   "verdict": "no change",
   "role": "none",
   "needs_gui": false,
   "reason": "Gui/DlgSettingsPathColor.ui and Path/Preferences.py: the new preferences are not experimental feature flags; the page does not describe them",
   "sections": []
  }
 ],
 "unmapped": [],
 "source": {
  "type": "upstream-pr",
  "ref": 32278
 },
 "meta": {
  "merge_commit": "0a9a02abe9b4a7d2ef60acc861b4cc0cef82cb9d",
  "merged_at": "2026-08-31T21:29:32Z",
  "title": "CAM: Theme-aware ToolBit shape drawings with dimension/field highlighting",
  "candidates": [
   "job/job.adoc",
   "reference/experimental.adoc",
   "reference/preferences.adoc",
   "tools/add-toolbit.adoc",
   "tools/tool-shape.adoc",
   "tools/toolbit.adoc"
  ],
  "unmapped_by_map": [
   "src/Mod/CAM/Path/Base/Gui/Theme.py"
  ],
  "files": 45,
  "release": "26.3",
  "model": "claude-opus-5-5",
  "cost_usd": 0.484128,
  "duration_ms": 19535,
  "session": "57d858d6-e074-4dbb-bcb5-f02541c027f7",
  "generated": "2026-10-11T19:15:20+00:00"
 }
}
