{
 "pr": 33254,
 "summary": "The linuxcnc Post-Processor writes a tilted Work Plane (G68.2, G53.1 or G53.6, G69) with a new `twp_kinematics_select` property and refuses DWO, and all machine-based Post-Processors now track the arc plane (G17, G18, G19) and drop only the arc center word along the normal of that plane.",
 "intent": "A reader can post a Job with tilted Work Planes to LinuxCNC. The reader learns that the linuxcnc Post writes `G68.2`, an align line from `twp_align` (`G53.1` or `G53.6`) and `G69`, that it accepts only the TWP rotation strategy and stops with an error for DWO, and that `twp_kinematics_select` adds a line after the preamble when an operation has a tilted tool axis. The reader also learns that the syntax follows a draft LinuxCNC pull request and can change. A reader also learns that each machine-based Post follows G17, G18 and G19 and drops only the center word along the plane normal, so a G17 arc has no K word and a G18 or G19 arc keeps its K word, and that the ignored and supported command lists match full command names. `output/postprocessor-customization.adoc` tells these two subjects. The other pages must agree on the Post-Processors that support Work Planes, the fanuc `parameter_order` default and arc output, the `Plane` attribute of `MachineState`, and G17, G18 and G19 as supported commands.",
 "pages": [
  {
   "page": "output/postprocessor-customization.adoc",
   "verdict": "revise",
   "role": "primary",
   "needs_gui": true,
   "reason": "Path/Post/scripts/linuxcnc_post.py: ROTATION_STRATEGIES = (\"twp\",), PLANE_COMMAND = G68_2, new machine property twp_kinematics_select, new help for pre_rotary_move and twp_align, PARAMETER_ORDER override removed; Path/Post/Processor.py: _convert_move drops the center word along the plane normal, _command_names matches the ignored and supported lists name by name, G17/G18/G19 are modal commands",
   "sections": [
    "Properties of the included Post-Processors",
    "Work Planes and rotary axes",
    "Commands and rapid moves",
    "Modal output and line numbers"
   ]
  },
  {
   "page": "output/post-process.adoc",
   "verdict": "revise",
   "role": "supporting",
   "needs_gui": false,
   "reason": "Path/Post/scripts/linuxcnc_post.py: the linuxcnc Post now writes tilted Work Planes (G68.2, G53.1, G69) and raises an error for a Machine set to DWO; opensbp_post.py: G17 tolerated, G18 and G19 refused",
   "sections": [
    "Included Post-Processors",
    "Work Planes"
   ]
  },
  {
   "page": "output/posts/fanuc.adoc",
   "verdict": "revise",
   "role": "supporting",
   "needs_gui": true,
   "reason": "Path/Post/scripts/fanuc_post.py: parameter_order default override removed (the default has K again) and G17 removed from EXTRA_SUPPORTED; Path/Post/Processor.py: a G18 or G19 arc keeps K and drops J or I",
   "sections": [
    "Defaults of the common properties",
    "Arcs"
   ]
  },
  {
   "page": "output/mbpp-postprocessor.adoc",
   "verdict": "revise",
   "role": "supporting",
   "needs_gui": false,
   "reason": "Path/Base/MachineState.py: new Plane attribute and addGcodeText(), Plane is not cleared by setState(None); Path/Post/Processor.py: command lists matched by name, a command with an empty name passes the filter, GCODE_PLANE added to the modal commands; linuxcnc_post.py is a new reference for ROTATION_STRATEGIES and PLANE_COMMAND",
   "sections": [
    "Work Planes and rotary axes",
    "MachineState",
    "Command filter and annotations",
    "Reference implementations"
   ]
  },
  {
   "page": "reference/scripting.adoc",
   "verdict": "revise",
   "role": "supporting",
   "needs_gui": false,
   "reason": "Constants.py: GCODE_PLANE (G17, G18, G19) added to GCODE_SUPPORTED; Path/Base/MachineState.py: Plane attribute, addGcodeText(), copy() keeps Plane",
   "sections": [
    "List of currently supported G-code commands",
    "MachineState"
   ]
  }
 ],
 "unmapped": [],
 "source": {
  "type": "upstream-pr",
  "ref": 33254
 },
 "meta": {
  "merge_commit": "c2bd9bab55441a108c632026e09c8faa71e2138a",
  "merged_at": "2026-10-11T06:14:15Z",
  "title": "CAM: LinuxCNC post supports tilted work planes (TWP)",
  "candidates": [
   "output/mbpp-postprocessor.adoc",
   "output/post-process.adoc",
   "output/postprocessor-customization.adoc",
   "output/posts/fanuc.adoc",
   "reference/scripting.adoc"
  ],
  "unmapped_by_map": [],
  "files": 13,
  "release": "26.3",
  "model": "claude-opus-5-5",
  "cost_usd": 0.3139552,
  "duration_ms": 25260,
  "session": "3f690bbc-f013-4774-9813-4975b9003cb9",
  "generated": "2026-10-11T19:15:51+00:00"
 }
}
